postUrl,comment_text,ownerUsername,date,month
https://www.instagram.com/pdamsuryasembada/reel/DXwzJx7Ttx0/,"setelah perbaikkan PAM jebol, kenapa air jadi tidak normal keluarnya? sebelum PAM jebol ,air di lantai 2 bisa nyala setiap saat jika di butuhkan. setelah PAM sudah di perbaiki, air di lantai 2 nyala cuman jam siang dan malam saja itupun hanya bentar keluarnya. terus mati lagi.",la_allu11,30/04/2026,April
https://www.instagram.com/pdamsuryasembada/reel/DXwzJx7Ttx0/,"Apa ada yang salam setelah perbaikan pam jebol aliran air jd tidk normal, malah lebih kecil dri sblmnya, apa belum selesai ya perbaikannya",dewiiwulan.ndari,30/04/2026,April
https://www.instagram.com/pdamsuryasembada/reel/DXwzJx7Ttx0/,Mau tanya ... Semenjak air bermasalah sekarang lelet krg jooss keluarnya,subaidahida01,30/04/2026,April
https://www.instagram.com/pdamsuryasembada/reel/DXwzJx7Ttx0/,"Punya saya jl kyai tambak deres, masih blm nyala sampai sekarang mulai hari kamis😥😥😢",siti.khoirini,30/04/2026,April
https://www.instagram.com/pdamsuryasembada/p/DXwBuWeDnkL/,@pdamsuryasembada dah kelar belom om? Kok menghilang,cupcubone,30/04/2026,April
https://www.instagram.com/pdamsuryasembada/reel/DXwzJx7Ttx0/,Alhamdulillah,salimachmadagus,30/04/2026,April
https://www.instagram.com/pdamsuryasembada/reel/DXwzJx7Ttx0/,"Belum Nyala sampai pagi ini ( 02/05) di Karang Asem , Mohon Perhatiannya",namirariy,30/04/2026,April
https://www.instagram.com/pdamsuryasembada/reel/DXwzJx7Ttx0/,Saran : setiap 15 thn dilakukan peremajaan,nawir.sar,30/04/2026,April
https://www.instagram.com/pdamsuryasembada/reel/DXwzJx7Ttx0/,Alhamdulillah setro v sdh nyala,nyonyasumarmi3,30/04/2026,April
https://www.instagram.com/pdamsuryasembada/reel/DXvgq-1k9wH/,"Kerja Lelet, sampai jam 19.14 air masih belum mengalir. Padahal Las sudah berapa jam.🥶🥶🥶🥶🥶",hendrosammodra,30/04/2026,April
https://www.instagram.com/pdamsuryasembada/reel/DXwzJx7Ttx0/,👏👏👏,bundafaila,30/04/2026,April
https://www.instagram.com/pdamsuryasembada/reel/DXwzJx7Ttx0/,Alhamdulillah dah ngalir walaupun kurang banter tp mudah2an bisa penuh tandonq. Terima kasih PDAM 🙏,mnizarhammadil,30/04/2026,April
https://www.instagram.com/pdamsuryasembada/reel/DXwzJx7Ttx0/,"Lebak jaya 2 msh belum nyala air smpe skrg, mohon infonya @pdamsuryasembada",vianlie82,30/04/2026,April
https://www.instagram.com/pdamsuryasembada/reel/DXwzJx7Ttx0/,Ini diruko manyar garden semolo nginden airnya malem nyala.. Kalau pagi mati bagaimana ini.. Ini bnyak usaha di ruko,rant_94,30/04/2026,April
https://www.instagram.com/pdamsuryasembada/p/DXwBuWeDnkL/,"Ayooo pak ndang nyala, dot e anakku numpuk iki 😭😭😭 kapan aku umbah2 dot e 😭",rizalinama,30/04/2026,April
https://www.instagram.com/pdamsuryasembada/reel/DXwzJx7Ttx0/,"dukuh setro rawasan sampai 1 mei 2026 pukul 23.40 tidak nyala sama sekali 2 hari. sudah hubungi call centre 6x katanya di cek, didatangi tapi sampai tengah malam selama 2 hari tidak datang, tidak ada konfirmasi. ini kalau tandon habis pakai apa ? tanah liat ? kita ini warga, KTP surabaya, jangan dimainin akan dtang, akan nyala, diusahakan tapi ga ada apapun hasilnya sampai 1 mei 2026 pukul 23.40",fikihafizalfarisi,30/04/2026,April
https://www.instagram.com/pdamsuryasembada/p/DXwBuWeDnkL/,Kedinding Tengah kering kerontaaaa miiin tulunnggg🥲🥲,ekas.lestari,30/04/2026,April
https://www.instagram.com/pdamsuryasembada/p/DXwBuWeDnkL/,Di tunggu sampai kapan ini air nya nyala? Kami butuh kepastian,christabel_caithlyn,30/04/2026,April
https://www.instagram.com/pdamsuryasembada/reel/DXvgq-1k9wH/,Update?? @pdamsuryasembada,r._dimas.story,30/04/2026,April
https://www.instagram.com/pdamsuryasembada/reel/DXvgq-1k9wH/,Medokan semampir masih mati airnya pak,bahrulsheriv,30/04/2026,April
https://www.instagram.com/pdamsuryasembada/reel/DXvgq-1k9wH/,"Suwun pak, ndang mari nggih ..
Aku arep ngising ga ono banyune, moso tayamum 😢",bhimabimok23,30/04/2026,April
https://www.instagram.com/pdamsuryasembada/reel/DXvgq-1k9wH/,Belom nyala daerah mulyosari nih,elvinanugraha,30/04/2026,April
https://www.instagram.com/pdamsuryasembada/reel/DXvgq-1k9wH/,"Kerjanya Lelet, sampai jam 18.00 air belum mengalir.",hendrosammodra,30/04/2026,April
https://www.instagram.com/pdamsuryasembada/reel/DXvgq-1k9wH/,masih lama lagi kah ini,pidzzyyyy,30/04/2026,April
https://www.instagram.com/pdamsuryasembada/p/DXwBuWeDnkL/,"Belum Nyala sampai pagi ini ( 02/05) di Karang Asem , Mohon Perhatiannya",namirariy,30/04/2026,April
https://www.instagram.com/pdamsuryasembada/reel/DXwzJx7Ttx0/,Terima kasih atas perbaikan pipa bocor.tp di wilayah terdampak aliran air PDAM msh blm normal seperti sediakala.mohon segera di optimalkan Aliran air ke pelanggan.td pagi di wilayah Semolowaru msh ada yg blm optimal,ambon_astrb,30/04/2026,April
https://www.instagram.com/pdamsuryasembada/p/DXwBuWeDnkL/,"mulyorejo pak , help 😭",berlianaprams_,30/04/2026,April
https://www.instagram.com/pdamsuryasembada/p/DXwBuWeDnkL/,Setro baru kapan nyalanya pak?,ratnaa.viaa,30/04/2026,April
https://www.instagram.com/pdamsuryasembada/p/DXwBuWeDnkL/,"Air di daerah lebak jaya tidak keluar sama sekali dari kemarin, tlp call centre sulit, wa susah 😢",dianliya2711,30/04/2026,April
https://www.instagram.com/pdamsuryasembada/p/DXwBuWeDnkL/,"dukuh setro rawasan sampai 1 mei 2026 pukul 23.40 tidak nyala sama sekali 2 hari. sudah hubungi call centre 6x katanya di cek, didatangi tapi sampai tengah malam selama 2 hari tidak datang, tidak ada konfirmasi. ini kalau tandon habis pakai apa ? tanah liat ? kita ini warga, KTP surabaya, jangan dimainin akan dtang, akan nyala, diusahakan tapi ga ada apapun hasilnya sampai 1 mei 2026 pukul 23.40",fikihafizalfarisi,30/04/2026,April
https://www.instagram.com/pdamsuryasembada/p/DXwBuWeDnkL/,Setro nyala jm brp????,nyonyasumarmi3,30/04/2026,April
https://www.instagram.com/pdamsuryasembada/p/DXwBuWeDnkL/,Uda ngalir belom??,rossalinalinda,30/04/2026,April
https://www.instagram.com/pdamsuryasembada/p/DXwBuWeDnkL/,"Halo kak, ini banyak warga yang tanya kapan air menyala/ progress dari perbaikan pipa kemajuannya sampai kapan. Kalau memang belum selesai akan lebih baik jika membalas pertanyaan warga dulu drpd di diemin seperti ini. Setidaknya kami bisa memanage air sampai air pdam nyala kembali.",afifahalwiaziz,30/04/2026,April
https://www.instagram.com/pdamsuryasembada/p/DXx3N6rElwo/,"Keputih tidak ada Air, telepon CS disuruh menunggu 1 - 2 hari lagi nih",irsyabinti,01/05/2026,May
https://www.instagram.com/pdamsuryasembada/p/DXx3N6rElwo/,Alhamdulillah min Ploso timur sdh kluar airnya tapi mulai dari pagi kyk ga niat mili no banyu min 😓 cuiliiiik e min,dahl_eeva48,01/05/2026,May
https://www.instagram.com/pdamsuryasembada/p/DXx3N6rElwo/,"dukuh setroo belum bisa, mau minta perbantuan tangki air gak dikasih lagi. gimana min air daerah dukuh setro gabisa bisa.",prabavanandap,01/05/2026,May
https://www.instagram.com/pdamsuryasembada/p/DXx3N6rElwo/,"setro v, 1 mei 2026 pkl 17.49 masih belum ngalir airnya. @pdamsuryasembada, berapa lama lagi????",chrisred_85,01/05/2026,May
https://www.instagram.com/pdamsuryasembada/p/DXx3N6rElwo/,"@pdamsuryasembada tolong di respon dong min,setro gak kluar"" air nya,trus sampek kapan",yudhabaguscahyono,01/05/2026,May
https://www.instagram.com/pdamsuryasembada/p/DXx3N6rElwo/,"Harlah Surabaya biasanya ada diskon pemasangan PDAM baru, kpn ada nggeh?",lesti8843,01/05/2026,May
https://www.instagram.com/pdamsuryasembada/p/DXx3N6rElwo/,Dukuh jerawat surabaya barat tiba2 gak ada air. Kenapa tidak ada pemberitahuan?,yosyagst,01/05/2026,May
https://www.instagram.com/pdamsuryasembada/p/DXy8ppzmcCR/,"Posting update bisa, tapi respon masyarakat gak bisa, piye to min min",fungkywijaya_fw,01/05/2026,May
https://www.instagram.com/pdamsuryasembada/p/DXy8ppzmcCR/,min setro minnnn!!!!!!!!!. air udah 24 jam ga mengalir. katanya normalisasi tapi kok sampe sekarang ga selesai-selesai??????????,chrisred_85,01/05/2026,May
https://www.instagram.com/pdamsuryasembada/p/DXy8ppzmcCR/,air dukuh setro belom bisa. minta perbantuan air jg gak dikasih. sampe kapan min air gabisa kayaak gini???,prabavanandap,01/05/2026,May
https://www.instagram.com/pdamsuryasembada/p/DXy8ppzmcCR/,Sampai malam ini 23.30 masih blm nyala airnya daerah Setro..,arynopriyanto,01/05/2026,May
https://www.instagram.com/pdamsuryasembada/p/DXy8ppzmcCR/,@pdamsuryasembada_ sampe saat ini wilayah setro belum nyala airnya ..@pdamsuryasembadasby,de_nog,01/05/2026,May
https://www.instagram.com/pdamsuryasembada/p/DXx3N6rElwo/,Pak untuk wilayah setro sampai saat ini tgl 1 mei pukul 20.26 masih belum keluar airnya 😢,lufitasarim,01/05/2026,May
https://www.instagram.com/pdamsuryasembada/p/DXx3N6rElwo/,Kalijudan belum keluar airr minnn 😢,kikikkk098,01/05/2026,May
https://www.instagram.com/pdamsuryasembada/reel/DXzH0qfSYpV/,❤️❤️🔥🔥🔥,berkah_damarasa_catering,01/05/2026,May
https://www.instagram.com/pdamsuryasembada/p/DXx3N6rElwo/,Dukuh setro belum ada air,ricohendri_07,01/05/2026,May
https://www.instagram.com/pdamsuryasembada/reel/DXzH0qfSYpV/,"Setelah terjadi nya kebocoran pipa di jembatan MERR , tagihan malah tambah melonjak, gak jelas nih PDAM 😑",syams.404,01/05/2026,May
https://www.instagram.com/pdamsuryasembada/reel/DXzH0qfSYpV/,"Setro air jangan di waktu. Kita butuh air sehari""nya.. Klo malam jatahnya orang istirahat.. Jam 4 pagi sudah mati nyala jam 1 malam..",fannitrisetiawan14,01/05/2026,May
https://www.instagram.com/pdamsuryasembada/reel/DXzH0qfSYpV/,MW bayar tagihan air nya kok belum bisa ya min?,nur_khulaifah,01/05/2026,May
https://www.instagram.com/pdamsuryasembada/reel/DXzH0qfSYpV/,"Air di setro tolong dong jangan di jam klo kluar, skg nyala jam 1 mlm jam 3 mati .. dulu 24jam nyala .. sy jga butuh tdr pak klo tiap hari jam 1 kluarnya .. buat apa pkek sanyo klo nyala malam aja .. dulu ga pkek sanyo ya mlm tok kluare .. skg sama aja .. udah bayar 1 bln 100rb air kluar cm 3jam ..",fannitrisetiawan14,01/05/2026,May
https://www.instagram.com/pdamsuryasembada/reel/DXzH0qfSYpV/,Kak gimana air daerah setro IV kok gak nyala sama sekali? Tolong lah di bantu nyala per jam brpa gt biar bisa beraktifitas min,ardllaika,01/05/2026,May
https://www.instagram.com/pdamsuryasembada/reel/DXzH0qfSYpV/,"Ini air di setro kapan normal nya ya ? Mati nyala, mati nyala.. Udah dari minggu kemarin loh kayak gini.. Nyala nya selalu tengah malem hingga subuh.. Dari pagi sampe tengah malem lagi mati air nya.. 😒😒",msud76,01/05/2026,May
https://www.instagram.com/pdamsuryasembada/reel/DXzH0qfSYpV/,"Pagi min, ini nomor telfon PDAM 08001926666 kenapa nggak bisa di call ya?",noviaaliff,01/05/2026,May
https://www.instagram.com/pdamsuryasembada/reel/DXzH0qfSYpV/,"tlong min air di setro udh gk kluar 3 hri, minta tolong bgt di fu,",moonstarslvly,01/05/2026,May
https://www.instagram.com/pdamsuryasembada/reel/DXzH0qfSYpV/,ada promo pasang baru gak min @pdamsuryasembada,zehaan_m_g,01/05/2026,May
https://www.instagram.com/pdamsuryasembada/reel/DXzH0qfSYpV/,air daerah setro belum nyala min,prabavanandap,01/05/2026,May
https://www.instagram.com/pdamsuryasembada/p/DXy8ppzmcCR/,"setro sampe skrg tgl 2 mei jam 7pagi ga nyala sama sekalii, ini gmn ya? udh chat call center jg dibalesnya cmn bot aja, hadehhh",fid.flov,01/05/2026,May
https://www.instagram.com/pdamsuryasembada/reel/DXzH0qfSYpV/,@pdamsuryasembada  Air daerah setro masih belum nyala gimana ini sudah 2 hari sampe sekarang belum nyala nyala,de_nog,01/05/2026,May
https://www.instagram.com/pdamsuryasembada/p/DXx3N6rElwo/,tagihan air apa2an 400rb bulan mei?? Bulan2 lalu pemakaian cuma 19-20m3 dengan tagihan 90-100rban. sekarang kenapa tiba2 76m???? Rumah cuma 2 orang. Ga ada kran bocor atau ledeng netes. Tandon jg dimatiin. Ini kenapa bisa begini min?!!,fikrifendi,01/05/2026,May
https://www.instagram.com/pdamsuryasembada/reel/DXzH0qfSYpV/,air dukuh setro belom bisa,prabavanandap,01/05/2026,May
https://www.instagram.com/pdamsuryasembada/reel/DXzH0qfSYpV/,"Butuh ados masak kora"" Umbah""",fannitrisetiawan14,01/05/2026,May
https://www.instagram.com/pdamsuryasembada/reel/DXzH0qfSYpV/,Dipancing sanyoe angin tok seng metu,fannitrisetiawan14,01/05/2026,May
https://www.instagram.com/pdamsuryasembada/p/DX1CyyAjnUY/,Ini perusahaan knp sih air mcet mulu bru 4 hari normal skrg g kluar lg air. Kita bayar woi maunya gmn!!!,wahyueka3094,02/05/2026,May
https://www.instagram.com/pdamsuryasembada/p/DX1CyyAjnUY/,"air ga keluar di sambiarum udah 2hr, ga ada pemberitahuan, 3minggu lalu jg begini, knp ini?",wahyudij0808,02/05/2026,May
https://www.instagram.com/pdamsuryasembada/p/DX1CyyAjnUY/,"Masyaallah kakek saya min 🥹. Semoga Ki Hajar Dewantara mendapatkan tempat terbaik di sisi Allah SWT, diampuni segala dosa-dosanya, dan diberikan pahala atas segala jasa serta pengabdiannya bagi bangsa dan pendidikan. Aamiin.",glenyusufsulaiman,02/05/2026,May
https://www.instagram.com/pdamsuryasembada/p/DX1CyyAjnUY/,Selamat Hari Pendidikan,likha.rk,02/05/2026,May
https://www.instagram.com/pdamsuryasembada/p/DX1CyyAjnUY/,air di lebak jaya IIIc setro belom ngalir sama sekali.,prabavanandap,02/05/2026,May
https://www.instagram.com/pdamsuryasembada/reel/DX5rjZ-yZrA/,Min mau tanya..??? Kalau bayar air pdam telat ada denda gak yaa..,fungkywijaya_fw,04/05/2026,May
https://www.instagram.com/pdamsuryasembada/reel/DX5rjZ-yZrA/,mohon info untuk Promo pasang baru PDAM di HUT Surabaya,madyonomad,04/05/2026,May
https://www.instagram.com/pdamsuryasembada/p/DX8zNnpOQB3/,"Min, ko rumahku airnya mati lagi dari tadi habis Maghrib 😢.",dakwahbaitulikhsan,05/05/2026,May
https://www.instagram.com/pdamsuryasembada/p/DX8zNnpOQB3/,"Min beberapa hari ini area rumah saya (alasmalang) air mengecil.. sampe kadang tidak bisa keluar di lantai 2 nya, tolong di bantu pelayanan nya baik dong min.. 🙏",baimnureffendy,05/05/2026,May
https://www.instagram.com/pdamsuryasembada/p/DX8zNnpOQB3/,Daerah surabaya barat air mengecil lagi ga seperti bulan2 kemarin kenapa sih bulan2 kemarin masih banter air nya keramas di lantai 2 masih bisa sekarang mandi di lantai 2 aj lelet banget keluar,bellaaristas,05/05/2026,May
https://www.instagram.com/pdamsuryasembada/p/DX8zNnpOQB3/,Reminder daerah setro 5 gimana. Sy byr pkek uang air cm 3jam,fannitrisetiawan14,05/05/2026,May
https://www.instagram.com/pdamsuryasembada/p/DX8zNnpOQB3/,"Min, hampir tiap hari kok air di rumah saya selalu mati dari pagi hingga magrib ya? Kejadian begini rutin dan jamnya selalu sama, air keluar di jam 8 sampai pukul 5, tet jam 6 pagi langsung mati.",seladaaaja,05/05/2026,May
https://www.instagram.com/pdamsuryasembada/p/DX8zNnpOQB3/,"Min,cek promo pemasangan pdam baru🙏",aditt_pello,05/05/2026,May
https://www.instagram.com/pdamsuryasembada/p/DX_a1xHjjaA/,Sam @hendro_hawk alumni TOT RPAM 🔥🔥🔥,gigihpdam,06/05/2026,May
https://www.instagram.com/pdamsuryasembada/p/DX_a1xHjjaA/,Pdam daerah gunung anyar sampe skg kenapa airnya kecil sekali ? Ga beres2 ya,ariefprayogoo,06/05/2026,May
https://www.instagram.com/pdamsuryasembada/p/DX-wfiPEjOH/,Pemberitahuan juga mendadak dan tidak setiap hari update lihat story pdam,lee_chamoomilee,06/05/2026,May
https://www.instagram.com/pdamsuryasembada/p/DX-wfiPEjOH/,apakah sumberejo berdampak pak ?,ade_putri_wardani,06/05/2026,May
https://www.instagram.com/pdamsuryasembada/p/DX-wfiPEjOH/,Gunung anyar sampe skg airnya kecil sekali,ariefprayogoo,06/05/2026,May
https://www.instagram.com/pdamsuryasembada/p/DX-wfiPEjOH/,Kenapa daerah tandes ikut mati?,alienpotret,06/05/2026,May
https://www.instagram.com/pdamsuryasembada/p/DX-wfiPEjOH/,Daerah darmo harapan pagi ini juga mati tanpa pemberitahuan,evirdihardja,06/05/2026,May
https://www.instagram.com/pdamsuryasembada/p/DX-wfiPEjOH/,Daerah darmo indah air nya mati dr td pagi subuh,agustina_lindawati,06/05/2026,May
https://www.instagram.com/pdamsuryasembada/p/DX-wfiPEjOH/,"Daerah darmo indah mati pagi ini, gaada info, ini gimana ?",averiltc,06/05/2026,May
https://www.instagram.com/pdamsuryasembada/p/DX-wfiPEjOH/,Tandes mati ini gk ada info blas,adellanovis,06/05/2026,May
https://www.instagram.com/pdamsuryasembada/p/DX-wfiPEjOH/,Tolong pak untuk perbaikan waktu nya di efisien supaya tidak memakan waktu lama karna tidak punya penyimpanan air,lee_chamoomilee,06/05/2026,May
https://www.instagram.com/pdamsuryasembada/p/DX-wfiPEjOH/,"Saya baca postingan ini jam 11.00. Diposting 2 jam lalu, berarti jam 9. Jam 10.00 mengecil hingga padam. Persiapan nampung airnya mana bisa sejam? Kalo yg blm sempat baca postingan bagaimana ini?",puthree_setiawan,06/05/2026,May
https://www.instagram.com/pdamsuryasembada/p/DYBcnI-EtOF/,Kira2 sampai jam brp?,alienpotret,07/05/2026,May
https://www.instagram.com/pdamsuryasembada/p/DYBcnI-EtOF/,Manukan dekat SMA 11 kok ikut mati pak,thary1299,07/05/2026,May
https://www.instagram.com/pdamsuryasembada/p/DYBcnI-EtOF/,Blm selsai sampai skrg,melissa_zhi2,07/05/2026,May
https://www.instagram.com/pdamsuryasembada/p/DYBiCn-khZY/,"𝙄𝙣𝙞 𝙙𝙞 𝙟𝙡𝙣. 𝙆𝙚𝙣𝙟𝙚𝙧𝙖𝙣 𝙎𝙞𝙢𝙤𝙠𝙚𝙧𝙩𝙤 𝙟𝙜 𝙞𝙠𝙪𝙩 𝙜𝙖𝙠 𝙠𝙚𝙡𝙪𝙖𝙧, 𝙗𝙞𝙖𝙨𝙖𝙣𝙮𝙖 𝙨𝙞𝙖𝙣𝙜 𝙙𝙞 𝙩𝙖𝙣𝙙𝙤𝙣 𝙗𝙖𝙬𝙖𝙝 𝙠𝙚𝙡𝙪𝙖𝙧 𝙞𝙣𝙞 𝙨𝙖𝙢𝙥𝙖𝙞 𝙨𝙤𝙧𝙚 𝙜𝙖𝙠 𝙖𝙙𝙖 𝙠𝙚𝙡𝙪𝙖𝙧, 𝙢𝙖𝙨𝙖 𝙞𝙠𝙪𝙩 𝙠𝙚𝙣𝙖 𝙞𝙢𝙗𝙖𝙨𝙣𝙮𝙖",ferry_irwanto_babe,07/05/2026,May
https://www.instagram.com/pdamsuryasembada/p/DYBonsIGUtB/,air daerah Setro V ga mengalir. apa ada perbaikan?,chrisred_85,07/05/2026,May
https://www.instagram.com/pdamsuryasembada/p/DYBcnI-EtOF/,kok masih belum nyala kak sampai sekarang?,bebekhitammm,07/05/2026,May
https://www.instagram.com/pdamsuryasembada/p/DYBcnI-EtOF/,Kakk... Di story sore Valve udah di buka.. ini jam 8 di Tubananan masih matiiii,nadnad.soe,07/05/2026,May
https://www.instagram.com/pdamsuryasembada/p/DYBcnI-EtOF/,Tandes?,aldilasaraswati,07/05/2026,May
https://www.instagram.com/pdamsuryasembada/p/DYBcnI-EtOF/,Area bulak banteng koq sulit air min...sehari cuma nyala 2x sore nyala sebentar trus mati..malam nyalanya tengah mlm bgt,hanzzbobok,07/05/2026,May
https://www.instagram.com/pdamsuryasembada/p/DYBcnI-EtOF/,"Min, kenapa air di rumah saya tidak keluar ya, dari pagi hingga isya, hal seperti ini rutin loh hampir tiap hari? Saya juga bayar tidak pernah nunggak. Tolong bantuannya 🙏🏻",seladaaaja,07/05/2026,May
https://www.instagram.com/pdamsuryasembada/p/DYBiCn-khZY/,"Manukan SMA 11 tgl 8 mei jam 17.30 sore mati lagi...kemarin jg mati baru nyala jam 11 malam, skrng mati lagi",thary1299,07/05/2026,May
https://www.instagram.com/pdamsuryasembada/p/DYBonsIGUtB/,,dewaamln,07/05/2026,May
https://www.instagram.com/pdamsuryasembada/p/DYFIv7xkjN0/,"daerah dukuh kupang tuh min tolong dong masak berhari hari debit air kecil banget sampe gabisa ngisi tandon, apalagi pas pagi hari saat jam aktivitas malah ga keluar parah banget",dhiaazm,08/05/2026,May
https://www.instagram.com/pdamsuryasembada/p/DYFIv7xkjN0/,daerah kalijaran sambikerep jg air nya mengecil s.d tidak keluar 😭 dan klo keluar air nya di jam-jam dini hari 😭 mohon bantuannya terima kasih 🙏 #airsumberkehidupan #airbersih #susahair,sriigatii_,08/05/2026,May
https://www.instagram.com/pdamsuryasembada/p/DYFIv7xkjN0/,Gadukan sudah 2 hari air lantai atas sm sekali g bs naik,my.dimsum7,08/05/2026,May
https://www.instagram.com/pdamsuryasembada/p/DYFIv7xkjN0/,"tadi dini hari (rabu 13.05.26) 😢 airnya tidak keluar lagi 😭 sedangkan kemarin (selasa 12.05.26) air nya keluar tapi sangat kecil sehingga tidak bisa mengalir ke tandon & bak kamar mandi, jadi hari ini sudah tidak punya air 😭 tiap hari begadang sampai pagi demi mendapatkan air 😭 mohon dengan sangat bantuannya terima kasih @pdamsuryasembada 🙏 @hrmn22___ @ekwintrio",sriigatii_,08/05/2026,May
https://www.instagram.com/pdamsuryasembada/p/DYFIv7xkjN0/,tadi malam begadang sampai pagi cek air berharap airnya keluar ternyata gak keluar2 airnya 😭 tolong mohon bantuannya terima kasih 🙏💔 minggu 10.05.2026 @hrmn22___ @ekwintrio,sriigatii_,08/05/2026,May
https://www.instagram.com/pdamsuryasembada/p/DYFIv7xkjN0/,Lalu bagaimana dengan Krembangan apakah tidak terdampak tolong kalau ada pemadaman pemberitahuan nya minimal empat hari sebelumnya agar warga bisa nandon air tolong kerjasamanya 🙏,shelomytha68,08/05/2026,May
https://www.instagram.com/pdamsuryasembada/p/DYFIv7xkjN0/,Min kenapa air diwilayah gadukan airnya mengecil keluarnya dan terkadang tidak keluar min @pdamsuryasembada,zulfanianggraini,08/05/2026,May
https://www.instagram.com/pdamsuryasembada/p/DYHLr5rGUfS/,HOS harus dipertahankan,priyandikadetta,09/05/2026,May
https://www.instagram.com/pdamsuryasembada/p/DYHLr5rGUfS/,,widyarigga,09/05/2026,May
https://www.instagram.com/pdamsuryasembada/p/DYHLr5rGUfS/,Salam dari Jambi min,baang_aziz,09/05/2026,May
https://www.instagram.com/pdamsuryasembada/reel/DYJuCntyf6i/,,syehan.arf_,10/05/2026,May
https://www.instagram.com/pdamsuryasembada/reel/DYJuCntyf6i/,,damaxrif,10/05/2026,May
https://www.instagram.com/pdamsuryasembada/reel/DYJuCntyf6i/,,fitriiaisyah_,10/05/2026,May
https://www.instagram.com/pdamsuryasembada/reel/DYJuCntyf6i/,i love Surabaya🫶,brxcyee,10/05/2026,May
https://www.instagram.com/pdamsuryasembada/reel/DYJuCntyf6i/,wahh mengedukasi skali🤩,megiikkk,10/05/2026,May
https://www.instagram.com/pdamsuryasembada/reel/DYJuCntyf6i/,"Musium di Area Tugu Pahlawan memang bagus, tapi sayang desàin yang seakan membuat Pagar keliling area Tugu memgganggu Pandangan, semua orang gak bisa menikmati ""glegernya"" Tugu Pahlawan secara utuh, karena terhalang ""pagar"", sekarang tinggal pandangan 25% ujungnya doang 😭😭",enenganang,10/05/2026,May
https://www.instagram.com/pdamsuryasembada/reel/DYJuCntyf6i/,,widyarigga,10/05/2026,May
https://www.instagram.com/pdamsuryasembada/reel/DYJuCntyf6i/,,nidybr_,10/05/2026,May
https://www.instagram.com/pdamsuryasembada/reel/DYJuCntyf6i/,WIHHH KWERENNN🔥,armuninggar_np,10/05/2026,May
https://www.instagram.com/pdamsuryasembada/reel/DYJuCntyf6i/,Mboisss 😍,riyanwahyu,10/05/2026,May
https://www.instagram.com/pdamsuryasembada/reel/DYJuCntyf6i/,Ada promo pemasangan baru kah d ultah sby,ainifazla,10/05/2026,May
https://www.instagram.com/pdamsuryasembada/reel/DYJuCntyf6i/,Nyalakan air rumahkuu seperti dulu 24jam bukan hanya 3jam aja,fannitrisetiawan14,10/05/2026,May
https://www.instagram.com/pdamsuryasembada/reel/DYJuCntyf6i/,geloooook💥💥💥,dewaamln,10/05/2026,May
https://www.instagram.com/pdamsuryasembada/p/DYMIlq5mTpb/,,widyarigga,11/05/2026,May
https://www.instagram.com/pdamsuryasembada/p/DYMIlq5mTpb/,🔥🔥🔥,r.n.s.y.h,11/05/2026,May
https://www.instagram.com/pdamsuryasembada/p/DYMIlq5mTpb/,lulusan putat gede ta iki @fafagif @r.n.s.y.h,davismultazam,11/05/2026,May
https://www.instagram.com/pdamsuryasembada/p/DYMIlq5mTpb/,Kulu kulu kulu kulu......👏👏👏👏👏👏,mbembis92,11/05/2026,May
https://www.instagram.com/pdamsuryasembada/p/DYMIlq5mTpb/,"Min, kenapa air di rumah saya tidak keluar ya, dari pagi hingga isya, hal seperti ini rutin loh hampir tiap hari? Saya juga bayar tidak pernah nunggak. Tolong bantuannya 🙏🏻",seladaaaja,11/05/2026,May
https://www.instagram.com/pdamsuryasembada/p/DYMIlq5mTpb/,Syukur Alhamdulillah Masih Bisa Mempertahankan Juara Penampilan Terbaik 👏 PAM Surya Sembada Kota Surabaya ❤️❤️❤️,anggachristianhananta,11/05/2026,May
https://www.instagram.com/pdamsuryasembada/p/DYMIlq5mTpb/,info min apakah ada promo min pemasangan baru,zulfiardillah182,11/05/2026,May
https://www.instagram.com/pdamsuryasembada/p/DYMod6mmQHB/,Debit air kenheran kecil mulu😢,yosuaandre96,11/05/2026,May
https://www.instagram.com/pdamsuryasembada/p/DYMIlq5mTpb/,😍😍😍😍,eventsuroboyo,11/05/2026,May
https://www.instagram.com/pdamsuryasembada/p/DYMIlq5mTpb/,Min info promo pemasangan baru,benkbenk_cuk31,11/05/2026,May
https://www.instagram.com/pdamsuryasembada/p/DYMod6mmQHB/,"min, ini kenapa berhari hari debit air di area dukuh kupang kecil banget mana sekarang ga ada air mengalir sama sekali??",dhiaazm,11/05/2026,May
https://www.instagram.com/pdamsuryasembada/p/DYMod6mmQHB/,Gimana air mati terus setiap jam 12 siang,hayy.masrull,11/05/2026,May
https://www.instagram.com/pdamsuryasembada/reel/DYL-DEVSy6J/,,dewaamln,11/05/2026,May
https://www.instagram.com/pdamsuryasembada/reel/DYL-DEVSy6J/,,widyarigga,11/05/2026,May
https://www.instagram.com/pdamsuryasembada/reel/DYL-DEVSy6J/,,damaxrif,11/05/2026,May
https://www.instagram.com/pdamsuryasembada/reel/DYO5f8oS5lX/,😍😍😍,tstrans_rentalmobilsurabaya,12/05/2026,May
https://www.instagram.com/pdamsuryasembada/p/DYPbp6qSQUh/,"PDAM surya sembada surabaya, Menerima komplain, tanpa penanganan. Saya warga surabaya daerah dukuh setro rawasan 28D mengadu sejak 11 mei 2026 dan 14 mei 2026 perihal air saya sejak januari hanya menyala jam 1 pagi sampai jam 4 pagi. Padahal sebelum tahun 2026 selalu menyala baik pagi, siang, malam. Dsri januari 2026 hanya menyala jam 1 sampai jam 4 lagi. Infonya ada petugas datang tidam datang, ada konfirmasi WA tidak ada konfirmasi. Padahal maksud saya jelaskan saja kenapa, harus bagaimana. Misal saya hrus bayar untuk memperbesar debit ya tidak apa2 asal ada konfirmasi dab penanganan. Ini tidak ada apa-apa sama sekali. Nnti saya komen media sosial salah, tapi saya tidak ada konfirmasi apapun lebih 2 hari. Menjelaskan. 2-3x berulang masalah sama setiap menelepon Ditanya masalah apa, lah kemarin2 apa tidak dicatat",fikihafizalfarisi,12/05/2026,May
https://www.instagram.com/pdamsuryasembada/reel/DYO5f8oS5lX/,Matur nuwun bapak @cakj1 untuk PDAM ❤️,anggachristianhananta,12/05/2026,May
https://www.instagram.com/pdamsuryasembada/reel/DYO5f8oS5lX/,"Badan pegal-pegal, kerja jadi gak fokus???... Jangan lupa pijat gaesss 🙌🙌❤️",halopijatsurabaya,12/05/2026,May
https://www.instagram.com/pdamsuryasembada/reel/DYO5f8oS5lX/,Kompak banget😍,nuri1huda,12/05/2026,May
