postUrl,comment_text,ownerUsername,date,month
https://www.instagram.com/pdamsuryasembada/p/DS75-cPEzvl/,"Mohon maaf ya, saya harus bilang kalau informasi penanganan dari @pdamsuryasembada sudah  terlambat, dikarenakan air sudah mengalir dengan baik dari pagi hari ini tanggal 7 Januari 2026, tapi tidak melalui pengaduan saya yg sudah saya ajukan sejak tanggal 5 Januari 2026. Terima kasih",bennykurniawansoe,01/01/2026,January
https://www.instagram.com/pdamsuryasembada/p/DS75-cPEzvl/,Putat jaya air pagi ini kok gak keluar ya kok mati,ketuagenkkapak69__,01/01/2026,January
https://www.instagram.com/pdamsuryasembada/p/DS75-cPEzvl/,😢,ketuagenkkapak69__,01/01/2026,January
https://www.instagram.com/pdamsuryasembada/p/DS75-cPEzvl/,Area lakarsantri dari kemarin tanggal 5 air mati. Sampai sekarang air juga masih mati. Pengaduan melalui aplikasi dari kemarin sore jam 17.12 sampai sekarang tidak ada tanggapan. Pengaduan melalui contact whatsapp juga tidak ada respon. Lalu ini harus pengaduan ke mana lagi?,bennykurniawansoe,01/01/2026,January
https://www.instagram.com/pdamsuryasembada/reel/DS_03Bmky5c/,tidak membuat inovasi produk berupa token meteran air? @pdamsuryasembada,ditagoap,02/01/2026,January
https://www.instagram.com/pdamsuryasembada/reel/DS_03Bmky5c/,Area lakarsantri dari kemarin tanggal 5 air mati. Sampai sekarang air juga masih mati. Pengaduan melalui aplikasi dari kemarin sore jam 17.12 sampai sekarang tidak ada tanggapan. Pengaduan melalui contact whatsapp juga tidak ada respon. Lalu ini harus pengaduan ke mana lagi?,bennykurniawansoe,02/01/2026,January
https://www.instagram.com/pdamsuryasembada/reel/DS_03Bmky5c/,Tooppp Komandan Bapak @hendro_hawk & Tim 🔥🔥🔥,anggachristianhananta,02/01/2026,January
https://www.instagram.com/pdamsuryasembada/reel/DS_03Bmky5c/,Cak Hendro n team👏,fendykusuma28,02/01/2026,January
https://www.instagram.com/pdamsuryasembada/reel/DTKZAD7kxqO/,😂😂😂 Bisa ae min,damaxrif,06/01/2026,January
https://www.instagram.com/pdamsuryasembada/reel/DTKZAD7kxqO/,lucu bgttt🤩,_frscarts,06/01/2026,January
https://www.instagram.com/pdamsuryasembada/reel/DTKZAD7kxqO/,"Suka banget lihat kontennya min, kreatif 😍👏",widyarigga,06/01/2026,January
https://www.instagram.com/pdamsuryasembada/reel/DTKZAD7kxqO/,Lucuu min 🤣🤣,presarioqalamm,06/01/2026,January
https://www.instagram.com/pdamsuryasembada/p/DTJyFeTE2Rm/,@pdamsuryasembada hidup nya yg normal aja ya bu/pak bukan di jatah mlm hidup pagi mati 🙏🏻,evabramasta_,06/01/2026,January
https://www.instagram.com/pdamsuryasembada/reel/DTKZAD7kxqO/,"Permisi, didaerah kedurus airnya kok mati ya?",bagasdio__,06/01/2026,January
https://www.instagram.com/pdamsuryasembada/reel/DTKZAD7kxqO/,"Tp koq suwii antri survey ne miinnn ??!! Aq daftar tgl 31 Des sampe skrg statusnya ""antri survey """,yuroul,06/01/2026,January
https://www.instagram.com/pdamsuryasembada/reel/DTKZAD7kxqO/,Susah banget ngehubungi call centre nya... melayani pelanggan lain terus,anang_fauzi1,06/01/2026,January
https://www.instagram.com/pdamsuryasembada/reel/DTKZAD7kxqO/,keri 🙌🏻 keri 🙌🏻 keri 🙌🏻,sintaaulch,06/01/2026,January
https://www.instagram.com/pdamsuryasembada/p/DTJyFeTE2Rm/,Kebacut kerjomu woy pdam,janjimstw,06/01/2026,January
https://www.instagram.com/pdamsuryasembada/reel/DTKZAD7kxqO/,😂😂Lucu bnget min kontennya,mhmdrizkyy12._,06/01/2026,January
https://www.instagram.com/pdamsuryasembada/p/DTJyFeTE2Rm/,Ini jam berapa ini hidup air nya PDAM wilayah Kota Tangerang,keripik_gemini,06/01/2026,January
https://www.instagram.com/pdamsuryasembada/p/DTJyFeTE2Rm/,Pak ini gmn infonya kok air mati lagi d surabaya utara,fika_fd06,06/01/2026,January
https://www.instagram.com/pdamsuryasembada/p/DTJyFeTE2Rm/,Air daerah setro mati mulai jam 4 sbuh nanti kluar jam 11 mlm 😢😢,nanik.cweet12,06/01/2026,January
https://www.instagram.com/pdamsuryasembada/p/DTJyFeTE2Rm/,"Pagi pak pak/bu knp ya minggu2 ini air nya setia pagi jam 6 mati pak/bu ada kendala apa?perbaikan nya dmn kok di daerah surabaya mati teru tama di setro baru IV tolong bu/pak d cek ,klo pagi ini butuh air pak brngkt kerja atau masak gak ada air dan gak punya penampung yg mau bli tanginya,ini saya setiap hari pakek galon aqua terus mohon pak/buk hidupnya yg normal bukan di jadah klo mlm hidup klo pagi mati ,saya baya terus pdam nya🙏🏻",evabramasta_,06/01/2026,January
https://www.instagram.com/pdamsuryasembada/p/DTJurbgk1s_/,Promo apa,syukur2199,06/01/2026,January
https://www.instagram.com/pdamsuryasembada/p/DTJurbgk1s_/,Maksud nya,syukur2199,06/01/2026,January
https://www.instagram.com/pdamsuryasembada/p/DTJurbgk1s_/,Assalamu'alaikum,syukur2199,06/01/2026,January
https://www.instagram.com/pdamsuryasembada/p/DTJyFeTE2Rm/,"Halo min , ini daerah setro kenapa dritdi pagi air tidak menyala ya? Sudah telfon ke pdam 2x belum ada tanggapan lebih lanjut @pdamsuryasembada",deviskkk,06/01/2026,January
https://www.instagram.com/pdamsuryasembada/p/DTJurbgk1s_/,pak/bu tolong cek permintaan pesan saya ada hal penting yg harus di sampaikan,dindarehai,06/01/2026,January
https://www.instagram.com/pdamsuryasembada/p/DTJyFeTE2Rm/,Yg jelas 2 hari apa gmn gtu,fika_fd06,06/01/2026,January
https://www.instagram.com/pdamsuryasembada/p/DTO77_YE5wY/,Kok ada kenaikan harga ya kak untuk tagihan airnya,indra.k.schuare,08/01/2026,January
https://www.instagram.com/pdamsuryasembada/reel/DTPzHiNk04G/,"Kebacut kerjomu !! Wayahe gangguan masyrk ga mbok kei kompensasi, tapi masyarakt telat mbok kei dendo .. Kerjomu ga berkah kabeh",janjimstw,08/01/2026,January
https://www.instagram.com/pdamsuryasembada/reel/DTPzHiNk04G/,"Min,saya daftar pasang baru tgl 31 des, status sampe skrg antri survei, brp lama ya antrinya",yuroul,08/01/2026,January
https://www.instagram.com/pdamsuryasembada/p/DTO77_YE5wY/,Kaka biaya pemindahan meteran berapa ya?,riey2n,08/01/2026,January
https://www.instagram.com/pdamsuryasembada/p/DTO77_YE5wY/,Area mojorejo mati knp ya?,dapoermamasjoe,08/01/2026,January
https://www.instagram.com/pdamsuryasembada/p/DTO77_YE5wY/,Buat apa pemeliharaan sistem? Komplain aja dicuekin.,heii_anin,08/01/2026,January
https://www.instagram.com/pdamsuryasembada/reel/DTSQ9Vtk2Cs/,"Min, saya daftar pasang baru di tanggal 31 des via aplikasi pdam, statusnya sampe skarng antri survey, koq lama ya antri surve nya??",yuroul,09/01/2026,January
https://www.instagram.com/pdamsuryasembada/reel/DTSQ9Vtk2Cs/,Lhuk... p.Eko luar biasa.. 👏,catur.birawa,09/01/2026,January
https://www.instagram.com/pdamsuryasembada/reel/DTSQ9Vtk2Cs/,"Min, saya daftar pasang baru di tanggal 31 des via aplikasi pdam, statusnya sampe skarng antri survey, koq lama ya antri surve nya??",yuroul,09/01/2026,January
https://www.instagram.com/pdamsuryasembada/reel/DTSQ9Vtk2Cs/,"Min, saya daftar pasang baru di tanggal 31 des via aplikasi pdam, statusnya sampe skarng antri survey, koq lama ya antri surve nya??",yuroul,09/01/2026,January
https://www.instagram.com/pdamsuryasembada/reel/DTSQ9Vtk2Cs/,"Min, saya daftar pasang baru di tanggal 31 des via aplikasi pdam, statusnya sampe skarng antri survey, koq lama ya antri surve nya??",yuroul,09/01/2026,January
https://www.instagram.com/pdamsuryasembada/reel/DTSQ9Vtk2Cs/,"Min, saya daftar pasang baru di tanggal 31 des via aplikasi pdam, statusnya sampe skarng antri survey, koq lama ya antri surve nya??",yuroul,09/01/2026,January
https://www.instagram.com/pdamsuryasembada/p/DTTzvoaE9sQ/,"Min, air ditempat saya udh seminggu ngalirnya pelan, seminggu ini kalau pagi mati 3-4 jam an, kalau sore juga sama 3-4 jam an",della.putri13,10/01/2026,January
https://www.instagram.com/pdamsuryasembada/p/DTTzvoaE9sQ/,"Saya mau pindah meteran, pembayaran sdh dari tanggal 21 januari. Sampai sekarang kabar saja blm ada, entah kapan dipindah",ha_nina_aja,10/01/2026,January
https://www.instagram.com/pdamsuryasembada/p/DTTzvoaE9sQ/,Ini harga sewa terbaru tahun 2026 ya.. Soalnya untuk konvensional rumah tangga biasanya 4000. Harusnya kasih keterangan itu kalau memang naik. 😂 @pdamsuryasembada,hendraarzhagit,10/01/2026,January
https://www.instagram.com/pdamsuryasembada/p/DTTzvoaE9sQ/,Mengenai pengaduan kenapa lama ya kak respondnya.....Sudah laporan pengaduan ke PDAM dari kemaren pagi. Tapi sampai Skrang masih belum ada petugas datang. Ini sudah 1x24 jam kak.  Apa harus laporan ke pusat Tah kak?,_hilyatulauliy4_,10/01/2026,January
https://www.instagram.com/pdamsuryasembada/p/DTTzvoaE9sQ/,"Semenjak ganti meteran baru kok tagihan melonjak yaa, padahal dirumah 3 org nih @pdamsuryasembada",tristafid,10/01/2026,January
https://www.instagram.com/pdamsuryasembada/p/DTTzvoaE9sQ/,kenapa air susah keluar nunggu di laporin 5 menit baru keluar,fthree_arvi,10/01/2026,January
https://www.instagram.com/pdamsuryasembada/p/DTTzvoaE9sQ/,Lantas jika pelanggan memilih sewa meter dgn ukuran kecil dan biaya yg murah apakah debit air juga ikut mengecil ya min ?? Tolong pencerahannya dong,lovasuraya,10/01/2026,January
https://www.instagram.com/pdamsuryasembada/p/DTTzvoaE9sQ/,GAK POKRO BLAAAAS! cuman goro enek acara haul banyu sak tabak wedi mbok boikot mbok glontorno kabeh nak area pemumikan haul!!!,einando_kusuma,10/01/2026,January
https://www.instagram.com/pdamsuryasembada/p/DTTzvoaE9sQ/,Untuk rumah tangga. Apa bisa minta pipa yang 1 dim. Rata2 di pasang 1/2,vicky_stray,10/01/2026,January
https://www.instagram.com/pdamsuryasembada/p/DTTzvoaE9sQ/,"Bayar telat kena denda ,tp air hidup e g tentu ,",basiliusaris,10/01/2026,January
https://www.instagram.com/pdamsuryasembada/p/DTTzvoaE9sQ/,Air di dukuh setro XI satu kampung gk lancar kak.. air keluar hanya malam saja.. ini mau saya kirim nomer pelanggang 1 kampung kah kak?,agus_teguh,10/01/2026,January
https://www.instagram.com/pdamsuryasembada/p/DTTzvoaE9sQ/,Halo min mau tanya kena air di rmh ku jd keruh biasanya jernih 2 hari ini keruh trs kenapa ya min bantu jawab rmh ku di rungkut,selvina_cahaya_ilahi,10/01/2026,January
https://www.instagram.com/pdamsuryasembada/p/DTTzvoaE9sQ/,"Di Sidotopo wetan knp kembali lagi kalau siang mati ya padhal 3bulanan sempat 24 jam airnya, pagi jam 5 mati sampe jam 14:00 nyala lagi terus jam 16:00 mati sampai 22:00 baru nyala lagi  pembayaran nya aja naik padahal😢",kopibijikurmaassyifa,10/01/2026,January
https://www.instagram.com/pdamsuryasembada/reel/DTVKiF_kwCZ/,"Min, please cek DM",dian_puspitorini,10/01/2026,January
https://www.instagram.com/pdamsuryasembada/p/DTTzvoaE9sQ/,yeah - it took only three months that the meter air was replaced. And the working style: yeah - it is a great style to leave working material and not cleaning up or throwing the garbage away. But okay. The handwriting on the paper: who should read that? Maybe I should ask a five-grader to translate the handwriting. Please: educate your people. It is unbelievable to deliver such handwriting - a monkey can do it better!,katschisby,10/01/2026,January
https://www.instagram.com/pdamsuryasembada/reel/DTVKiF_kwCZ/,👏,tama.tjakrindomas,10/01/2026,January
https://www.instagram.com/pdamsuryasembada/reel/DTVKiF_kwCZ/,Bangga jadi bagian aset Perumda Air Minum Surya Sembada Kota Surabaya😍🔥🔥🔥,pdamsby.properti,10/01/2026,January
https://www.instagram.com/pdamsuryasembada/reel/DTVKiF_kwCZ/,Mantap luar biasa🔥🔥👍👍👍,darwiyantodarwin,10/01/2026,January
https://www.instagram.com/pdamsuryasembada/reel/DTVKiF_kwCZ/,"Finally 🔥🔥, kerennn",akmalreyhnth,10/01/2026,January
https://www.instagram.com/pdamsuryasembada/reel/DTVKiF_kwCZ/,😍😍😍,rahmatsahrul652022,10/01/2026,January
https://www.instagram.com/pdamsuryasembada/p/DTSEOrjk_5U/,"Min, saya daftar pasang baru di tanggal 31 des via aplikasi pdam, statusnya sampe skarng antri survey, koq lama ya antri surve nya??",yuroul,10/01/2026,January
https://www.instagram.com/pdamsuryasembada/p/DTSEOrjk_5U/,"Min, saya daftar pasang baru di tanggal 31 des via aplikasi pdam, statusnya sampe skarng antri survey, koq lama ya antri surve nya??",yuroul,10/01/2026,January
https://www.instagram.com/pdamsuryasembada/p/DTSEOrjk_5U/,"Min, saya daftar pasang baru di tanggal 31 des via aplikasi pdam, statusnya sampe skarng antri survey, koq lama ya antri surve nya??",yuroul,10/01/2026,January
https://www.instagram.com/pdamsuryasembada/p/DTSEOrjk_5U/,"Min, saya daftar pasang baru di tanggal 31 des via aplikasi pdam, statusnya sampe skarng antri survey, koq lama ya antri surve nya??",yuroul,10/01/2026,January
https://www.instagram.com/pdamsuryasembada/p/DTSEOrjk_5U/,Ini ditunda jd kapan min?,a.paramita_s,10/01/2026,January
https://www.instagram.com/pdamsuryasembada/p/DTSEOrjk_5U/,"kalo bs pengerjaanya diats jam 7 malam ,buar kita ndak susah air sy orang menanggak , dan jika bisa diinfi dikelurahaan rt dan rw ,kemarin sy kehabisan air karena tdk tau",aan_ainur_sahabat,10/01/2026,January
https://www.instagram.com/pdamsuryasembada/p/DTSEOrjk_5U/,Min @pdamsuryasembada daerah Setro Baru Tambaksari apa ada perbaikan? Kok sudah seminggu mati min PDAM-nya. Mohon info.,karimatunisak,10/01/2026,January
https://www.instagram.com/pdamsuryasembada/p/DTUGBCmkwdR/,"Complain pdam kemana lg ya, udh buat pelaporan tidak ada respon, tlp call center jg gk bs",srstoresidoarjo,10/01/2026,January
https://www.instagram.com/pdamsuryasembada/p/DTUGBCmkwdR/,"Pdam surabaya, udh buat pelaporan masih aja blm di fup sampe skr, 2 hari nunggu gk ada petugas yg datang",srstoresidoarjo,10/01/2026,January
https://www.instagram.com/pdamsuryasembada/p/DTUGBCmkwdR/,Sudah di dm juga tidak ada respon,srstoresidoarjo,10/01/2026,January
https://www.instagram.com/pdamsuryasembada/reel/DTVKiF_kwCZ/,Cakep Min 👏😍,widyarigga,10/01/2026,January
https://www.instagram.com/pdamsuryasembada/p/DTTzvoaE9sQ/,Bagaimana cara cek untuk ID pelanggan baru ?,emmasmeer,10/01/2026,January
https://www.instagram.com/pdamsuryasembada/p/DTZce3hE5cb/,Di jalan Pawiyatan air nya mati apa ada perbaikan.. Karena ng ada info,leonardagustinus1,12/01/2026,January
https://www.instagram.com/pdamsuryasembada/p/DTZce3hE5cb/,Sampai jam berapa ya kak air nya bisa normal lagi...,soetomoandriana,12/01/2026,January
https://www.instagram.com/pdamsuryasembada/p/DTZce3hE5cb/,untuk gangguannya sampai jam brp ya min? d sidosermo air nya kecil,nvtatwn_,12/01/2026,January
https://www.instagram.com/pdamsuryasembada/p/DTZce3hE5cb/,Percuma minta bantuan air tapi pelayanan nya lamban,puguhpembayun_92,12/01/2026,January
https://www.instagram.com/pdamsuryasembada/p/DTZce3hE5cb/,Perak Timur apa juga terdampak???,mardianti.yuli,12/01/2026,January
https://www.instagram.com/pdamsuryasembada/reel/DTcYdIBk3W_/,Semangat 🥭👏👏,widyarigga,13/01/2026,January
https://www.instagram.com/pdamsuryasembada/reel/DTcYdIBk3W_/,"Min, baca dm ku min...",isnievanya,13/01/2026,January
https://www.instagram.com/pdamsuryasembada/reel/DTcYdIBk3W_/,semangat kakakkkkkkk👏🏻,sandymhrn_,13/01/2026,January
https://www.instagram.com/pdamsuryasembada/reel/DTcYdIBk3W_/,Semangattt tim pdam surabaya 👏,tetehegii,13/01/2026,January
https://www.instagram.com/pdamsuryasembada/reel/DTcYdIBk3W_/,Semangat mas Angga.😍😍,elisabethliliknurwulan,13/01/2026,January
https://www.instagram.com/pdamsuryasembada/reel/DTcYdIBk3W_/,Semangat om angga 👍🏻,ellya2609,13/01/2026,January
https://www.instagram.com/pdamsuryasembada/reel/DTcYdIBk3W_/,semangat om pak angga,zynokonter,13/01/2026,January
https://www.instagram.com/pdamsuryasembada/reel/DTcYdIBk3W_/,Dimana ada om Angga disitu pasti ada kebocoran 😂,rendraxvsn,13/01/2026,January
https://www.instagram.com/pdamsuryasembada/reel/DTcYdIBk3W_/,Semangat Pak Angga,muhammad_r051,13/01/2026,January
https://www.instagram.com/pdamsuryasembada/reel/DTcYdIBk3W_/,🔥🔥,smartgis.id,13/01/2026,January
https://www.instagram.com/pdamsuryasembada/reel/DTcYdIBk3W_/,Semangat untuk semua petugas Perumda Air Minum Surya Sembada Kota Surabaya 👏👏 dan mas mangga 🥭 @anggachristianhananta yang sedang bertugas 😇,damaxrif,13/01/2026,January
https://www.instagram.com/pdamsuryasembada/reel/DTcYdIBk3W_/,Semangat pak angga dan tim 👏👏👏,deprisetiawan_,13/01/2026,January
https://www.instagram.com/pdamsuryasembada/reel/DTcYdIBk3W_/,Hujan panas tak menghalangi 💪,why.rdnt,13/01/2026,January
https://www.instagram.com/pdamsuryasembada/p/DTeo_Vjk6lG/,@pdamsuryasembada mimin PONDOK BENOWO INDAH PDAMnya mati🧐,angga_79.nq,14/01/2026,January
https://www.instagram.com/pdamsuryasembada/p/DTeo_Vjk6lG/,"min, ini pondok benowo indah ko mati airnya tapi gada pemberitahuan",natnu.tt,14/01/2026,January
https://www.instagram.com/pdamsuryasembada/p/DTkCcWWE7nZ/,Call centernya kok tidak terdaftar ya?,febrinags_,16/01/2026,January
https://www.instagram.com/pdamsuryasembada/p/DTkCcWWE7nZ/,Tagihan air sampai 500rb biasanya 60rb an kenapa besar sekali skrg,mochammadiqbalrizki,16/01/2026,January
https://www.instagram.com/pdamsuryasembada/p/DTkCcWWE7nZ/,"Maaf Min @pdamsuryasembada OOT, mohon tanya Min, sebelah kiri rumah pakai sanyo, meteran putaran nya cepat sekali, berbeda bila sebelah tidak menyalakan sanyo nya, solusi nya bagaimana ya Min ? Rumah kakek pemakaian hanya 10³ sedangkan saya bulan kemarin 17³ dan sekarang sudah 17³ masih tgl 17",dianrosita08,16/01/2026,January
https://www.instagram.com/pdamsuryasembada/p/DTkCcWWE7nZ/,"Permisi saya mau menghidupkan air pdam lagi karena sudah diputus oleh pdam sebab sudah tidak perne dipakai lagi, kebetulan juga saya juga lupa nomor pelanggan saya, alamatnya ada di JL Pucang Anom No. 85 A Surabaya, @pdamsuryasembada",fathanghalih,16/01/2026,January
https://www.instagram.com/pdamsuryasembada/reel/DTr0oB3k-Cf/,"Sudah 3 hari bangunnya kesiangan min jadi 3 hari itu airnya tidak hidup TOLONG lah min barangkali komplain disinii di respon, soalnya kalo di TikTok ga ada respon bluasss",zazakiiya,19/01/2026,January
https://www.instagram.com/pdamsuryasembada/reel/DTr0oB3k-Cf/,"assalamualaikum warahmatullahi wabarakatuh izin komplain ya min🙏,
PDAM dirumah saya airnya ga hidup min kalo bukan jam diatas jam 00.00 kalo udah jam 4 subuh itu mati min kadang ya udh jam set 4 itu dah mati lagi min dah ga akan hidup min intinya hidupnya cuma sekali sehari,kalo ga bangun dijam segitu ya alamat min airnya gakan hidup, udah 2 hari telat terus bangunya min alhasil ga dapet waktu air hidup, ini ga sebulan dua bulan ya min 😘,kadang hidup sih min di jam 11 tp airnya tuh ngalirnya kueecil bgt, sebelumnya udah komplain min di tiktok pas bulan sebelumnya² nya tp gada respon pas tadi malam syaa komplain lagi min tp ttp aja tidak ada respon dan hanya mengunjungi profil saya sedangkan komen saya ga direspon min😢😢😢",zazakiiya,19/01/2026,January
https://www.instagram.com/pdamsuryasembada/reel/DTu_5TYk_R-/,Masyaallah keren bu yenny,fitrimn12,20/01/2026,January
https://www.instagram.com/pdamsuryasembada/reel/DTu_5TYk_R-/,masyaallah ibu yenny😍,megiikkk,20/01/2026,January
https://www.instagram.com/pdamsuryasembada/reel/DTu_5TYk_R-/,"Semoga Bu Yenny selalu diberikan kesehatan, agar bisa terus memberi sumbangsih terbaik untuk masyarakat kota Surabaya. 🔥🔥🔥 Matursuwun sanget Bu.",nuri1huda,20/01/2026,January
https://www.instagram.com/pdamsuryasembada/reel/DTu_5TYk_R-/,"masyaAllahh,sehat selalu Ibuu😍❤️",armuninggar_np,20/01/2026,January
https://www.instagram.com/pdamsuryasembada/reel/DTu_5TYk_R-/,semangatt teruss❤️‍🩹,dewaamln,20/01/2026,January
https://www.instagram.com/pdamsuryasembada/reel/DTu_5TYk_R-/,"Masa tugas boleh berakhir, namun semangat, dedikasi, dan keteladanan Bu Yenny akan terus hidup dan menginspirasi. Terima kasih telah menjadi bagian penting dari perjalanan Surya Sembada 😇🙏🏻",damaxrif,20/01/2026,January
https://www.instagram.com/pdamsuryasembada/reel/DTu_5TYk_R-/,"kerenn bu yenny, sehat selalu❤️",nauvalf._,20/01/2026,January
https://www.instagram.com/pdamsuryasembada/reel/DTu_5TYk_R-/,"kereennn, sehat selalu ibuu yennyy🤍",nidybr_,20/01/2026,January
https://www.instagram.com/pdamsuryasembada/reel/DTu_5TYk_R-/,masyaAllah keren sekali bu Yenny😍🫰,nassaats,20/01/2026,January
https://www.instagram.com/pdamsuryasembada/p/DTubyA9k9bZ/,Menyala Panti ku eh K3 kuuu tks dan sukses buat semuanya 🔥🔥,aprieus,20/01/2026,January
https://www.instagram.com/pdamsuryasembada/p/DTubyA9k9bZ/,,er_erik_,20/01/2026,January
https://www.instagram.com/pdamsuryasembada/p/DTubyA9k9bZ/,,widyarigga,20/01/2026,January
https://www.instagram.com/pdamsuryasembada/p/DTubyA9k9bZ/,👏🔥,alifan_rachman,20/01/2026,January
https://www.instagram.com/pdamsuryasembada/p/DTubyA9k9bZ/,,adpe_87,20/01/2026,January
https://www.instagram.com/pdamsuryasembada/p/DTubyA9k9bZ/,Menyala 🔥,rizqiamrii,20/01/2026,January
https://www.instagram.com/pdamsuryasembada/p/DTubyA9k9bZ/,Engga kena gak cipta ta kak? Hehehe,why.rdnt,20/01/2026,January
https://www.instagram.com/pdamsuryasembada/p/DTubyA9k9bZ/,Keren PPO menyala abangku...2026..🔥🔥🔥,isapdam,20/01/2026,January
https://www.instagram.com/pdamsuryasembada/reel/DTu_5TYk_R-/,"masyaallah,sehat selalu bu yenny❤️",sherlyaz,20/01/2026,January
https://www.instagram.com/pdamsuryasembada/p/DTubyA9k9bZ/,🔥,louisgatu,20/01/2026,January
https://www.instagram.com/pdamsuryasembada/p/DTubyA9k9bZ/,,damaxrif,20/01/2026,January
https://www.instagram.com/pdamsuryasembada/reel/DTu_5TYk_R-/,waw😍,meidhin_,20/01/2026,January
https://www.instagram.com/pdamsuryasembada/reel/DTu_5TYk_R-/,semangat dan sehat selalu ibu yenny🥰❤️‍🩹,fitriiaisyah_,20/01/2026,January
https://www.instagram.com/pdamsuryasembada/reel/DTu_5TYk_R-/,Selamat memasuki masa pensiun/purna tugas bu Yenny. Semoga selalu diberikan kesehatan dan kebahagiaan wal dunia wal akhirat,widyarigga,20/01/2026,January
https://www.instagram.com/pdamsuryasembada/reel/DTu_5TYk_R-/,"Keren bu Yenny sangat menginspirasi, sehat selalu 🤍",shelviiapr,20/01/2026,January
https://www.instagram.com/pdamsuryasembada/p/DTubyA9k9bZ/,,hajarpakerti214,20/01/2026,January
https://www.instagram.com/pdamsuryasembada/reel/DTu_5TYk_R-/,"keren bu yenny, sehat selalu 👏",syehan.arf_,20/01/2026,January
https://www.instagram.com/pdamsuryasembada/p/DTwpaIYEyQU/,"Ayo di percepat pak untuk mengerjakannya , soal nya butuh semua ditunggu loh",ervina7740,21/01/2026,January
https://www.instagram.com/pdamsuryasembada/p/DTwpaIYEyQU/,Pukul 21.00 tp skrg air sudah tidak keluar,jung.julia.jk,21/01/2026,January
https://www.instagram.com/pdamsuryasembada/p/DTwpaIYEyQU/,PDAM daerah Lebak Rejo Utara 6 mota mati ae air e setiap hari. Mbecekno ga pagi ga siang ga sore ga malam mati terus air e,jocelyn_aileena_jean,21/01/2026,January
https://www.instagram.com/pdamsuryasembada/p/DTwpaIYEyQU/,𝙋𝙚𝙧𝙗𝙖𝙞𝙠𝙖𝙣 𝙢𝙚𝙡𝙪𝙡𝙪 𝙩𝙚𝙩𝙖𝙥𝙞 𝙨𝙚𝙩𝙞𝙖𝙥 𝙢𝙞𝙣𝙜𝙜𝙪𝙣𝙮𝙖 𝙖𝙞𝙧 𝙩𝙚𝙧𝙠𝙖𝙙𝙖𝙣𝙜 𝙠𝙚𝙧𝙪𝙝 𝙨𝙖𝙢𝙥𝙖𝙞 𝙘𝙖𝙥𝙚𝙠 𝙗𝙞𝙠𝙞𝙣 𝙡𝙖𝙥𝙤𝙧𝙖𝙣 𝙙𝙞 𝙣𝙤 𝙒𝘼 𝙋𝘿𝘼𝙈,yuli4elizabeth,21/01/2026,January
https://www.instagram.com/pdamsuryasembada/p/DTwpaIYEyQU/,"Admin, kenapa Taman Indah PDAM mati ya tanpa informasi?",a.paramita_s,21/01/2026,January
https://www.instagram.com/pdamsuryasembada/p/DTwpaIYEyQU/,Apakah sudah nyala,malang_alun2,21/01/2026,January
https://www.instagram.com/pdamsuryasembada/p/DTwpaIYEyQU/,"Ga mati aja daerah situ rawan susah air, semoga lekas membaik pdam 😢",manukanmall27,21/01/2026,January
https://www.instagram.com/pdamsuryasembada/p/DTwpaIYEyQU/,"Wah sering banget daerah sini bermasalah, mnurut keyakinan ku ini spertinya ada yg gak beres ini min... Tp kira² apa yah???",ed.rust.14,21/01/2026,January
https://www.instagram.com/pdamsuryasembada/reel/DTzxZd_k6UP/,😂kadang 110 115 125 400 425,ichsanguntur,22/01/2026,January
https://www.instagram.com/pdamsuryasembada/reel/DTzxZd_k6UP/,,abdulkarim2905,22/01/2026,January
https://www.instagram.com/pdamsuryasembada/reel/DTzxZd_k6UP/,,damaxrif,22/01/2026,January
https://www.instagram.com/pdamsuryasembada/reel/DTzxZd_k6UP/,Min area gayungan ada kendala air kah ?,arsitadesi,22/01/2026,January
https://www.instagram.com/pdamsuryasembada/reel/DTzxZd_k6UP/,😂,basdwias,22/01/2026,January
https://www.instagram.com/pdamsuryasembada/reel/DTzxZd_k6UP/,,fitrimn12,22/01/2026,January
https://www.instagram.com/pdamsuryasembada/reel/DTzxZd_k6UP/,,nvrrmd,22/01/2026,January
https://www.instagram.com/pdamsuryasembada/reel/DTzxZd_k6UP/,Min @pdamsuryasembada Menanggal sekitar lagi gangguan lagi?  Ga ada info yaa,rii.roo,22/01/2026,January
https://www.instagram.com/pdamsuryasembada/reel/DTzxZd_k6UP/,"Iya, yang waras ga bole dipelintir 😑",auceming,22/01/2026,January
https://www.instagram.com/pdamsuryasembada/reel/DTzxZd_k6UP/,😂😂😂😂😂miinn bisa aja dah,arynpu3,22/01/2026,January
https://www.instagram.com/pdamsuryasembada/reel/DTzxZd_k6UP/,pakkk😂,fitriiaisyah_,22/01/2026,January
https://www.instagram.com/pdamsuryasembada/reel/DTzxZd_k6UP/,,megiikkk,22/01/2026,January
https://www.instagram.com/pdamsuryasembada/reel/DTzxZd_k6UP/,ahahah,selmahumayra,22/01/2026,January
https://www.instagram.com/pdamsuryasembada/p/DTzFTt9E8Cb/,🙌🙌,megiikkk,22/01/2026,January
https://www.instagram.com/pdamsuryasembada/p/DTzFTt9E8Cb/,Keren cover e @bobbyrama82,radityatanu_,22/01/2026,January
https://www.instagram.com/pdamsuryasembada/p/DTzFTt9E8Cb/,Idola banget pemenang Airo Inovation 👏🔥,widyarigga,22/01/2026,January
https://www.instagram.com/pdamsuryasembada/reel/DTzxZd_k6UP/,"Min dari tgl 2 januari kemarin aku udah pesen penggantian stop kran dari aplikasi, sudah bayar juga, tapi sampai skrg belum ada penggantian, aku telfon call center bpjs malah katanya udah ada yg ganti, padahal gaada org pdam datang kerumah sama sekali, tolong tindak lanjutnya ya, mengingat sudah hampir 1 bulan ini sejak aku bayar",andrewanggoroputro,22/01/2026,January
https://www.instagram.com/pdamsuryasembada/p/DT0HdazE1F-/,Untuk th 2026 apakah ada discount untuk PSR?,aryonolukito,22/01/2026,January
